[
   {
      "id": 1021,
      "name": "Betreiber",
      "question": "Welches Verkehrsunternehmen betreibt die Verkaufsstelle?",
      "input": {
         "type": "String",
         "values": {
            "_default_": {
               "osm_tags": {
                  "operator": "%s"
               }
            }
         }
      },
      "conditions": [
         {
            "osm_tags": {
               "shop": "ticket",
               "tickets:public_transport": "yes",
               "operator": false
            }
         }
      ],
      "difficulty": 0
   },
   {
      "id": 1021,
      "name": "Öffnungszeiten",
      "question": "Wann ist diese Fahrkartenverkaufsstelle geöffnet?",
      "input": {
         "type": "OpeningHours",
         "values": {
            "_default_": {
               "osm_tags": {
                  "opening_hours": "%s"
               }
            },
            "false": {
               "osm_tags": {
                  "opening_hours": "24/7"
               }
            }
         }
      },
      "conditions": [
         {
            "osm_tags": {
               "shop": "ticket",
               "tickets:public_transport": "yes",
               "opening_hours": false
            }
         }
      ],
      "difficulty": 1
   },
   {
      "id": 1022,
      "name": "Für Rollstuhlfahrer zugänglich",
      "question": "Ist die Verkaufsstelle stufenfrei erreichbar?",
      "description": "Stufenfrei bedeutet, eine Schwelle ist weniger als 3cm hoch.",
      "input": {
         "type": "Bool",
         "values": {
            "true": {
               "osm_tags": {
                  "wheelchair": "yes"
               }
            },
            "false": {
               "osm_tags": {
                  "wheelchair": "no"
               }
            }
         }
      },
      "conditions": [
         {
            "osm_tags": {
               "shop": "ticket",
               "tickets:public_transport": "yes",
               "wheelchair": false
            }
         }
      ],
      "difficulty": 0
   },
   {
      "id": 1031,
      "name": "Betreiber",
      "question": "Welches Verkehrsunternehmen betreibt die Informationsstelle?",
      "input": {
         "type": "String",
         "values": {
            "_default_": {
               "osm_tags": {
                  "operator": "%s"
               }
            }
         }
      },
      "conditions": [
         {
            "osm_tags": {
               "tourism": "information",
               "information": "office",
               "operator": false
            }
         }
      ],
      "difficulty": 0
   },
   {
      "id": 1031,
      "name": "Öffnungszeiten",
      "question": "Wann ist diese Informationsstelle geöffnet?",
      "input": {
         "type": "OpeningHours",
         "values": {
            "_default_": {
               "osm_tags": {
                  "opening_hours": "%s"
               }
            },
            "false": {
               "osm_tags": {
                  "opening_hours": "24/7"
               }
            }
         }
      },
      "conditions": [
         {
            "osm_tags": {
               "tourism": "information",
               "information": "office",
               "opening_hours": false
            }
         }
      ],
      "difficulty": 1
   },
   {
      "id": 1032,
      "name": "Für Rollstuhlfahrer zugänglich",
      "question": "Ist die Informationsstelle stufenfrei erreichbar?",
      "description": "Stufenfrei bedeutet, eine Schwelle ist weniger als 3cm hoch.",
      "input": {
         "type": "Bool",
         "values": {
            "true": {
               "osm_tags": {
                  "wheelchair": "yes"
               }
            },
            "false": {
               "osm_tags": {
                  "wheelchair": "no"
               }
            }
         }
      },
      "conditions": [
         {
            "osm_tags": {
               "tourism": "information",
               "information": "office",
               "wheelchair": false
            }
         }
      ],
      "difficulty": 0
   },
   {
      "id": 1050,
      "name": "Parkplatz",
      "description": "Öffentliche Parkplätze, die von Reisenden in Anspruch genommen werden können und sich in direkter Zuordnung zur Station befinden. Einzelne Parkplätze am Straßenrand fallen nicht unter diese Definition.",
      "image": [
         "assets/questions/image/1050.png"
      ],
      "question": "Gibt es öffentliche Parkplätze für Reisende?",
      "input": {
         "type": "Bool",
         "values": {
            "true": {
               "osm_tags": {
                  "amenity": "parking",
                  "access": "yes"
               }
            },
            "false": {}
         }
      },
      "osm_element": "ClosedWay",
      "difficulty": 1
   },
   {
      "id": 1051,
      "name": "Parkplatzart",
      "question": "Um welche Parkplatzart handelt es sich?",
      "input": {
         "type": "List",
         "values": {
            "surface": {
               "name": "Parkplatz",
               "image": "assets/questions/image/1051a.jpg",
               "osm_tags": {
                  "parking": "surface"
               }
            },
            "underground": {
               "name": "Tiefgarage",
               "image": "assets/questions/image/1051b.jpg",
               "osm_tags": {
                  "parking": "underground"
               }
            },
            "street_side": {
               "name": "Parkbucht",
               "image": "assets/questions/image/1051c.jpg",
               "osm_tags": {
                  "parking": "street_side"
               }
            },
            "multi-storey": {
               "name": "Parkhaus",
               "image": "assets/questions/image/1051d.jpg",
               "osm_tags": {
                  "parking": "multi-storey"
               }
            }
         }
      },
      "conditions": [
         {
            "osm_tags": {
               "amenity": "parking",
               "access": [
                  "yes",
                  false
               ]
            }
         }
      ],
      "difficulty": 0
   },
   {
      "id": 1051,
      "name": "Behindertenparkplätze",
      "question": "Gibt es hier gesonderte Parkplätze für beeinträchtigte Personen?",
      "input": {
         "type": "Bool",
         "values": {
            "true": {
               "osm_tags": {
                  "capacity:disabled": "yes"
               }
            },
            "false": {
               "osm_tags": {
                  "capacity:disabled": "no"
               }
            }
         }
      },
      "conditions": [
         {
            "osm_tags": {
               "amenity": "parking",
               "access": [
                  "yes",
                  false
               ],
               "capacity:disabled": false
            }
         }
      ],
      "difficulty": 0
   },
   {
      "id": 1051,
      "name": "Behindertenparkplätze",
      "question": "Wie viele Parkplätze für beeinträchtigte Personen gibt es hier?",
      "input": {
         "type": "Number",
         "decimals": 0,
         "min": 1,
         "values": {
            "_default_": {
               "osm_tags": {
                  "capacity:disabled": "%s"
               }
            }
         }
      },
      "conditions": [
         {
            "osm_tags": {
               "amenity": "parking",
               "access": [
                  "yes",
                  false
               ],
               "capacity:disabled": "yes"
            }
         }
      ],
      "difficulty": 0
   },
   {
      "id": 1052,
      "name": "Öffnungszeiten",
      "question": "Wann darf hier geparkt werden?",
      "input": {
         "type": "OpeningHours",
         "values": {
            "_default_": {
               "osm_tags": {
                  "opening_hours": "%s"
               }
            },
            "false": {
               "osm_tags": {
                  "opening_hours": "24/7"
               }
            }
         }
      },
      "conditions": [
         {
            "osm_tags": {
               "amenity": "parking",
               "access": [
                  "yes",
                  false
               ],
               "opening_hours": false
            }
         }
      ],
      "difficulty": 1
   },
   {
      "id": 1052,
      "name": "Park+Ride",
      "description": "Park & Ride-Anlagen sind Parkplätze mit Anbindung zu öffentlichen Verkehrsmitteln, die Personen, die in die Innenstädte fahren, ermöglichen, ihr Fahrzeug zu verlassen und für den Rest der Reise auf öffentliche Verkehrsmittel umzusteigen.",
      "image": [
         "assets/questions/image/1052.png"
      ],
      "question": "Ist dies ein Park+Ride-Parkplatz?",
      "input": {
         "type": "Bool",
         "values": {
            "true": {
               "osm_tags": {
                  "park_ride": "yes"
               }
            },
            "false": {
               "osm_tags": {
                  "park_ride": "no"
               }
            }
         }
      },
      "conditions": [
         {
            "osm_tags": {
               "amenity": "parking",
               "access": [
                  "yes",
                  false
               ],
               "park_ride": false
            }
         }
      ],
      "difficulty": 1
   },
   {
      "id": 1052,
      "name": "Aufenthaltsdauer",
      "question": "Wie lange darf hier maximal geparkt werden?",
      "input": {
         "type": "Duration",
         "unit": "d:1,h:1,m:5",
         "values": {
            "_default_": {
               "osm_tags": {
                  "maxstay": "%s"
               }
            },
            "false": {
               "osm_tags": {
                  "maxstay": "no"
               }
            }
         }
      },
      "conditions": [